{"expires":"2027-10-19T23:59:59Z","key_id":"sha256-9d5bb3864ff7ef9829e582b42667735fbd6937885294737a053c47c49eab2bac","payload_sha256":"3b3e114bdc595e7e7e73dd1ad8c27c5abd19ffb79f3b91734ccf1b993c0c57db","role":"component:alignment.mfa.models.es419:1.0.0","schema_version":1,"sequence":1,"signature":"uFUJqFU80KTFAneCCkDmtX+EyCuKc92y6jiJ4ize4YJT9B3pHlR0++jlvnC0DLHBPXiaGJMWaGD0Sa6v8qM7Aw=="}
