{"expires":"2027-01-17T00:00:00Z","key_id":"sha256-9d5bb3864ff7ef9829e582b42667735fbd6937885294737a053c47c49eab2bac","payload_sha256":"918b15c0796f327c2ae768e70337a84757c1f5310f7e6f66d454cb4d97f71779","role":"component:transcription.whisper.models.base:1.0.0","schema_version":1,"sequence":1,"signature":"xNDkAKGl88lBvkrn680S28MGqZhYUy8XLSvG6WEdMTUIYmaQ/wMGgW9lYDFSh8KSEhCwYx7bVFAFCztl+ysVAA=="}
