{"expires":"2027-10-19T23:59:59Z","key_id":"sha256-9d5bb3864ff7ef9829e582b42667735fbd6937885294737a053c47c49eab2bac","payload_sha256":"048b847cbb3b6329b68beb38b55aff5b0b4ae7c0f20e3d6ca3a29abda995eb89","role":"component:alignment.mfa.models.fr:1.0.0","schema_version":1,"sequence":1,"signature":"2PbDUNo1snQu0jNyVIbC80MS7aRMJxkiVBiSHfbsll3i0t/ypPTW18Dxa1+prF8hGm2PNu6PDrlM0kKENye/Bg=="}
