{"expires":"2027-10-19T23:59:59Z","key_id":"sha256-9d5bb3864ff7ef9829e582b42667735fbd6937885294737a053c47c49eab2bac","payload_sha256":"426f4d53061878471c622715a2ab656d6140d82c941e3852f795958b482b4efe","role":"component:alignment.mfa.models.de:1.0.0","schema_version":1,"sequence":1,"signature":"al1/XkjoBzamEkRjzpzwmVtoXHrS8rA2Gx7H1U3kGAAdAo7kQYWYeN7GyH6MgZPXOfnNglOOCm6MZjAsHWqNBQ=="}
