{"expires":"2027-10-17T00:00:00Z","key_id":"sha256-b0de7333001cf49461150e3bcded71c69ffc593c5544212e66ae460071b03c38","payload_sha256":"c16674488a785055d82094c832fb00d4904ebedd91fdb725463be1dac7363970","role":"root","schema_version":1,"sequence":1,"signature":"CVQAq9RmXAgGg8dGGrCiF1Quh3jUKRhDKPNXnhDLPe+OVSDMnqav8AfB9K735BfwSkBy5Y/POuLChWfLuPNoCA=="}
