{"expires":"2027-10-19T23:59:59Z","key_id":"sha256-9d5bb3864ff7ef9829e582b42667735fbd6937885294737a053c47c49eab2bac","payload_sha256":"9f7671f18ed5093a0b0e9ade5b1afeb833c176870a4d634b36c70f42a7e1df80","role":"component:alignment.mfa.runtime:1.0.2","schema_version":1,"sequence":1,"signature":"K2A/48svenAhSeD9jX6Zf/wIdZKg8HkLgCwgKzxcp2af91HWTjLZ9KkhTeqPM+x5WzaN69/oNU10TkUH/iVqDw=="}
