{"expires":"2027-10-19T23:59:59Z","key_id":"sha256-9d5bb3864ff7ef9829e582b42667735fbd6937885294737a053c47c49eab2bac","payload_sha256":"17fd288f90bbf32b7dcd48e8feae3be41edca5688f30396da722a850f5edc53f","role":"component:alignment.mfa.models.ptbr:1.0.0","schema_version":1,"sequence":1,"signature":"dhPZm2RHkz+ur2nrqmEPC8CnUv4LXKa9HfGrC7Pr8ZQe6m9JiIpGPFhnz367qeF2Ub1wXQENq6d9ggIfF/HdBw=="}
