{"expires":"2027-01-17T00:00:00Z","key_id":"sha256-9d5bb3864ff7ef9829e582b42667735fbd6937885294737a053c47c49eab2bac","payload_sha256":"26dd1d4d196fde19dca826ff4e646a33601c507eca1432c533036ad19d2e235e","role":"channel:beta","schema_version":1,"sequence":2,"signature":"rm0DyT9YmwBImSih1Ai5OdIZBQKTDnGiiD4FBqLE6QcE98HRmMMWODV+x7zidN7xX4FxDt8fOZ4BDCJioElSDQ=="}
